context,response
I've decided to start writing a novel.,"Oh, great, because the world was just missing a 500-page manuscript about your feelings."
My maternity leave just ended.,I'm gonna have the labor department down here so fast they won't even...
"Hey, I hope Ross didn't think that we just went in there because we were uncomfortable being out here!",I hope he did!
"Hello? Oh, Pheebs! It's Phoebe!","Oh, yay..."
You put these on my desk!,"I did not! So you're saying they just slid out of your bottom drawer, crawled across the floor, then jumped on to my desk?!"
"I just feel like someone reached down my throat, grabbed my small intestine, pulled it out of my mouth and tied it around my neck...",Cookie?
I just got engaged to my soulmate.,"Wow, that's great. I'm sure the 37 Instagram stories about your ring will totally validate your existence."
You look good.,"Thanks! Y'know, that when you say things like that it makes me wanna rip that sweater vest right off!"
"Wow, Monica! What an amazing opportunity to influence...",dozens of people.
"Joey, what are you doing with the bag? You're audition is not until tomorrow.","Yeah, but sandwich time is right now."
Do you realize this is probably the last time we'll all be here in the coffee house as six single people?,Yep! From now on its gonna be the four of you guys and me and the misses. The little woman. The wife. The old ball and chain.
How can you have a roommate that none of us know anything about?,Maybe because you never listen to anything that I say. I talk about her all the time! DENISE!!!!!
I just got engaged to my girlfriend.,"Wow, congratulations! Could I BE any more thrilled for you?"
I've decided to become a professional snail trainer.,"Oh, finally, a career that combines your love of speed and exciting nightlife. Could I BE any more thrilled for you?"
"I'm sorry, I guess I just like the pulp.",It's not all juice!
"Ohh, gee. I wonder why she thinks you're going to call her?",That's what you say at the end of a date.
I think Monica would be very interested to know that you called her cheesecake dry and mealy.,What do we use to split it?
Let me buy you a lap dance with those girls. Huh?,"Oh that's all right sir, and that's just one girl."
I've decided to become a professional clown.,"Oh, great, because the world was just missing a 30-year-old man in face paint and a bright orange wig, making $200 at children's birthday parties."
This is not like learning to ride a horse! This is like learning to...grow a turtleneck!,I kn-I know! I know! Okay?
Joey: How come you don't live with Mommy? How come Mommy lives with that other lady? What's a lesbian?,"Ok, you're going to have to stop that, forever!"
You proposed to her?,"No! No, and I did not ask her to marry me!"
You kicked off your shoes!,"Can we, can we just forget this ever happened?"
Joey made a home movie for his acting career.,You couldn't have at least changed your shirt.
Does it not freak you that you're never gonna sleep with anybody else?,"Sleeping with somebody new, anxiety, panic, and I'm afraid even more sweating."
I've decided to start writing a novel.,"Oh, great. Because the world was just missing a 500-page manuscript about your feelings."
I've decided to become a professional snail trainer.,"Oh, right, because the world was just missing a guy who can make a slug wear a tiny hat."
Have you written your vows yet?,"I figured I'd buy those. Pat, I'd like to buy a vow."
Joey: Her answer machine?,"No, interestingly enough her leaf blower picked up."
Nope.,Do I still call you Ross?
"You know when people hear about our situation they always ask, 'what, you live together but you're not a couple? And you have a baby, isn't that weird?'","Uh, clearly."
Not for the next few minutes.,"During this time...are you, are you still my best man?"
Ross Geller: The Geller Cup.,Is everybody else seeing a troll doll nailed to a two by four?
"And so, we're hiding in the bathroom.","I got a good one, I got a good one! I once walked in on both my parents making love to the same guy."
You really think that'll work?,"Hey, I can be pretty charming, babe, I won YOU over, didn't I?"
I just got engaged to my soulmate.,"Wow, that's great. Could I BE any more thrilled for you?"
"Yeah, but don't you think....","All right look, if you absolutely have to tell her, at least wait until the timing's right. And that's what deathbeds are for."
Why do all you're coffee mugs have numbers on the bottom?,"Oh. That's so Monica can keep track. That way if one on them is missing, she can be like, 'Where's number 27?!'"
It's not what you said. It's the way you said it...,"Oh My God, I'm a woman!!!"
"Phoebe Buffay: Look out, incoming pumpkin pie!","Ok, we all laughed when you did it with the stuffing, but that's not funny anymore."
I guess I'm done.,Fun's over!
"Your birthday is in a month-and-a-half, what do you say I forget to get you a present for that too?",You are totally and completely 100% forgiven.
I miss hanging out with you.,"Well y'know, things are different. I'm...I'm married now."
You did it! You got ordained?,Our minister...
and there's five hundred extra dollars in my account.,"Oh, Satan's minions at work again..."
"Hello! Oh yeah! It's the apartment manager; Ross put us down as references. Ross is the greatest guy you'll ever meet! Yeah, he's very reliable.","Of course he has this big huge dog! That uh, barks into the night. Well, who doesn't love dogs? Ah, he's a tap dancer! Yes, some would say that is a lost art. He's a pimp! There you go! Yes, he's a pimp. He's a big, tap dancing pimp! Hello?"
I've decided to become a professional snail trainer.,"Oh, finally, a career that utilizes your extensive experience in moving slowly and leaving a trail of slime."
"We've been driving for a half-hour, and you haven't looked at the road once.","Don't worry, it's out there! I think I just need lunch."
"Hey, hey. How was the first day?","See, it pays to know the man who wears my shoes. Me."
I just found out that Elizabeth's dad wants to meet me.,"Wait a minute, hold the phone! You're not Elizabeth's dad?!"
I've decided to become a professional clown.,"Yeah, because the world really needs another grown man in face paint, crying on the inside."
So did Monica tell you about this great band called the Swing Kings that we're trying to get to play at the wedding?,Oh since forever! I used to go all over town listening to bands!
"Oh, can you believe they gave Stephanie skin cancer?",I still can't believe they promoted her to lieutenant.
I've decided to start writing a novel.,"Oh, great, because the world was just missing a 500-page manuscript about your feelings."
"Oh, I had to sleep with the ugliest guy to get that job.",Really?!
I just got engaged to my soulmate.,"Oh, wow, congratulations! Could I BE any more thrilled for you and your impending lifetime of compromise and arguing over who left the dishes in the sink?"
"Oh, howd she take it?","Pretty well. Except for the stapler thing. Little tip: if youre ever in a similar situation, never ever leave your hand... ..on the desk."
"Ooh! Look! Look! Look! Look, there's Joey's picture! This is so exciting!","You can always spot someone who's never seen one of his plays before. Notice, no fear, no sense of impending doom..."
How long has it been this time?,90 seconds.
"Umm, how's it going with you guys?","Oh, better, actually. Y'know I-I-I think I finally figured out why we were having so much trouble lately."
"Morning, hey, you made pancakes?","Yeah, like there's any way I could ever do that."
Why not?,Because it says 'Captain Ross' on the side and 'I hate Monica' on the bottom.
"So, what are you guys doing four weeks from today?",I am... free!
Do you wanna do it at the same time?,Count of three?
"I don't want to be single, okay? I just... I just- I just wanna be married again!",And I just want a million dollars!
Morning. We ready to go?,"Well, don't we look nice all dressed up?...It's stuff like that, isn't it?"
You got the clothes clean. Now that's the important part.,"Oh, I guess. Except everything looks like jammies now."
"Just be yourself. But, not too much.",Wish me luck.
Why are your eyes so white?,"You tell me! Maybe, it's because I was just fooling with my ex! Oh no-no-no-no, no-no-no-no, that was you!!"
I just got engaged to my soulmate.,"Wow, that's great. I'm sure the 37 times you've used that term this month have nothing to do with the open bar at the wedding."
Hey! Check this out? Huh? Yeah. That's the stuff. What do you think?,"Well, I don't have to buy that, ""I'm with stupid"" T-shirt anymore."
We're moving to Tulsa!,"Shhhh! Shhhhh! Shhhhh! Shhhhh! I can't, I can't hear you."
"Monica, I'm unemployed and in dire need of a project. Ya wanna work out? I can remake you.","Oh, you know, I would, but that might get in the way of my lying around time."
You said you'd marry Joey?,"Okay you have to realize, I was exhausted, I was emotional, I would have said yes to anybody."
"So, what are you doing here? I thought tonight was your big anniversary dinner.","Yeah, little change in plans. Ahh, we're gonna break-up instead."
You gotta take the canoe!,"All right, just, just take the entertainment center, and then when you get home, throw the canoe away!"
I like her so much!,"You are aware that she's not a monkey, right?"
Today is the sixth?,"Yes, it's also 2003."
"Oh well, hey, Joey's loveable too! But the thing about Joey is, if you need him, he'll be there.","Well, Chandler will be there for you too. I mean, well, he might be a little late, but-but, he'll be there. And he'll bring you some cold soda, if want you need him for is that you're really hot."
Oh yeah? When?,"All right. I'll tell you what. When we're 40, if neither one of us are married, what do you say you and I get together and have one?"
"There wasn't any change from that twenty, was there?","No, it came out to an even twenty."
I just got engaged to my soulmate.,"Wow, a soulmate. How convenient. Now you'll have someone to share your misery with for the rest of your life."
What is it?,"It's yelling...bleeding...dilating. Oh, the dilating..."
"So ah, isn't a bit cold out for shorts?","Right, right. Sometimes you guys just burst into flames."
I'm sure you get another one at Ann Taylor's.,That's my favorite shirt! Okay? I love that shirt!
I've decided to start writing a novel.,"Oh, great. Because the world is just missing a 500-page memoir about your feelings on socks."
I'm tellin' you. You can't do this.,"Oh, come on. I can never get a girl like that with conventional methods."
I've decided to become a professional snail trainer.,"Oh, finally, a career that combines your love of slime and unemployment."
"Look, are you dating this girl you came with?","Well, I was hoping after tonight that maybe I could you know..."
I just got engaged to my girlfriend.,"Oh, great. Because what you really needed was someone to witness your gradual decline into baldness and utter desperation."
We're supposed to organize the wrapping paper drawer.,"Yes, but I feel like I've really gotten in touch with my feminine side enough today. You know. In fact I think we're two sachets away from becoming a lesbian couple."
I know you can do this. Okay? You have a beautiful smile.,I do?
"She was all crying. She-she said you guys want different things, and that and that she needed time to think.",Well why didn't you stop her?! Why didn't you just tell her it was a plan?!
"Y'know what Chandler, you got yourself into those cuffs, you get yourself out of them.",No-no-no-no-no-no-no!! I can't get myself right out of them! You must have me confused with the Amazing Chandler!!
"Um, has uh Dr. Franzblau been by?","Rachel, what is the deal with you and doctors, anyway? Was, like, your father a doctor?"
"Joey's loveable too! But the thing about Joey is, if you need him, he'll be there.","Well, Chandler will be there for you too. I mean, well, he might be a little late, but-but, he'll be there. And he'll bring you some cold soda, if want you need him for is that you're really hot."
I've decided to start writing a novel.,"Oh, great, because the world was just missing a 500-page memoir about your feelings on socks."
I just got engaged to the love of my life.,"Wow, congratulations! Could I BE any happier for you... said no one ever."
I just want to be married again!,And I just want a million dollars!
I just got engaged to my girlfriend.,"Oh, great, so now you're officially doomed to spend the rest of your life with someone who's still somehow convinced you're a good idea."
"Alright, here, you have to hold this.","OK. Brake left, gas right?"
I've decided to start a gardening hobby.,"Oh, fantastic, because what I've always wanted is a friend who's secretly a 60-year-old retired accountant."
You go back out there and you seduce her till she cracks!,"Okay, give me a second! Did you clean up in here?"
That's fine!,"That's just a lot of big talk, y'know."
Someone sent us a basket at work once and people went crazy over those little muffins.,Your work makes me sad.
"Oh, I believe it. I think the baby can totally hear everything. I can show you. Look, this will seem a little weird, but you put your head inside this turkey, and then we'll all talk, and you'll hear everything we say.","I'd just like to say that I'm totally behind this experiment. In fact, I'd very much like to butter your head."
"OK, if you say stop, then we stop.","OK, stop."
"Listen, uh, I don't know when I'm gonna see you again.","Well, I'm guessing uh, tonight at the coffee house."
"Ross Geller: Oh, thanks Gunther. STUPID BRITISH SNACK FOOD!!!!!!!",Did they teach you that in your anger management class?
You're more the fun parent.,"Look, I may not know a lot about babies, but do you really think I'm not capable?"
You have to name all the states in six minutes,"Now, that's a lot harder than it sounds. You always forget at least one, or in some cases... fourteen"
I just got engaged to my soulmate.,"Wow, congratulations! Could I BE any happier for you?"
I just got engaged to my soulmate.,"Wow, a soulmate. How convenient. Now you'll have someone to share your therapy bills with."
What about the third guy?,You mean the guy who kept staring at your chest?
Alright alright. You're a monkey. You're loose in the city. Where do you go?,"Okay, it's his first time out, so he's probably gonna wanna do some of the touristy things. I'll go to Cats, you go to the Russian Tea Room."
"Monica knows what she wants to say! You should've seen her. Writing, writing, writing!",I'm so pathetic!
I just got engaged to my girlfriend.,"Oh, great, so now you're stuck with someone who's contractually obligated to listen to you."
"You just, you look so different! Terrific! That dress! That body!",Bad time. Sorry!
I just got engaged to the love of my life.,"Oh, wonderful! Could I BE any more thrilled for you?"
"If you and I are both single by the time we're 40, we get married, I mean, we know each other, we like each other, and we've already slept together so there'll be no surprises there","Ohh, you want me to be your backup"
I was shrieking... like a girl... is not a backhand.,I was shrieking... like a Marine.
I just got engaged to my girlfriend.,"Oh, wow. Because nothing says 'I love you' like a lifelong commitment to someone who's still learning how to use a dishwasher."
"It's my dad's birthday, I decided to give him a stroke.","Oooh, Rich is goin' to the party too, huh?"
Joey smells gas!,What else is new?
Maybe we should just walk? Let's go.,What's going on? Okay? Okay? These boots were a huge mistake! They're killing me! One toe at a time!
Maybe somebody came in here and fixed it! Or something!,Someone like an...angel?
They think they are so slick messing with us! But see they don't know that we know that they know!,"Ahh yes, the messers become the messies!"
I just got engaged to my girlfriend.,"Oh, wow! Could I BE any happier for you? Said no one, ever."
Ross Geller: I remember the moonlight coming through the window- and her face had the most incredible glow.,"Yes, the moon, the glow, the magical feeling, you did this part- Could I get some painkillers over here, please?"
All this lying has been hard on us too.,"Well, yeah actually."
"Joey, what's going on. What didn't you tell us you work here?",So is your apron. You're wearing it like a cape.
"Will you pick one, just pick one! Here, how about that one?",That's patio furniture!
I just got engaged to my soulmate.,"Wow, that's great. I'm sure the 37 other girls you've called your soulmate will be thrilled to hear that."
I just got engaged to the love of my life.,"Wow, that's great. I'm sure the 12 minutes you've known them is a solid foundation for a lifelong commitment."
I know you'll be crying a river inside.,"Aww, I love you so..."
"Guys, please, I'm just gonna have dinner with him. Okay?","Okay, okay, just because he buys you dinner, does not mean you owe him anything."
Today's the day Carol and I first.. consummated our physical relationship. Sex.,Eleven days before Halloween.. all the good costumes are gone?
You faked it? You couldn't have faked it!,Oh yes you can. You just make the faces and the noises.
Joey's tailor took advantage of him.,"He said he was going to do my inseam, and he ran his hand up my leg, and then, there was definite... Cupping."
My boots in tan! Hey! Can you get a little closer so I can see the price?,It'll cost you one husband.
"So, so, what'd ya think?",Almost as good as that play with the two naked girls on the see-saw.
"Hey you guys, guess what?",The British are coming?
I just got engaged to my soulmate.,"Wow, that's great. I'm sure the 37 other girls you've called your soulmate will be thrilled to hear that."
"If I won $5,000 I'd join a gym, y'know build up my upper body",and hit Richard from behind with a stick!
"Well, are we all together? Like in a group?",Stop it! You're killing me! I think I just moved on to Phase Four!
He's your father; he should be at the wedding.,I don't even know the man. Okay? We're not the close. I haven't seen him in years.
I just didn't get a chance to say goodbye.,Y'know what? You can say goodbye to the tan ones.
You have any idea what this'll do for your sex life?,"Well, it'll probably slow it down at first but, once I get used to the extra weight, I'll be back on track."
You ready?,"Honey, the tortilla chips know what you mean."
Second date!,...I dunno.
You had a dream about a girl that I am seeing?!,"Oh, that is so cool! I can't tell you how many times I've dreamt about a girl that he was seeing."
"Hey, where are all my ovulation-sticks? There's only one here.",I might have checked to see if I was ovulating a couple times.
I just got engaged to my soulmate.,"Oh, wonderful! Because nothing says 'true love' like a legally binding contract and a lifetime of arguing over whose turn it is to do the dishes."
"Yeah, me too.","Actually, can I get some hot water with a little lemon? I think I strained my voice screaming in there. Does it have to be so loud?"
Well no.,Miracle!
"A TV as if it appears from nowhere! That's the dream! Man, how did you afford this stuff?","Well, y'know I'm 29. I mean who needs a savings account."
"Hey. Man, it is so hard to shop for girls.","Yes, it is, at Office Max."
"Well, that went well. Yeah.","It could've been worse, he could've shot her."
"Well, if you don't have anything to copy, why are you going down there?
Yeah, are you just going down there to gawk at that hot girl with the belly button ring again?",Yeah! You wanna come?
I went from store to store sitting on Santa's lap.,"Yeah. Yeah, I remember trying to steal a cardboard cutout of Evander Holyfield from a Foot Locker."
"Ross, did you really read all these baby books?
Ross: Yup! You could plunk me down in the middle of any woman's uterus, no compass, and I can find my way out of there like that!","And, we're done with the yogurt."
"Well Chandler, what is this very weird, metal A Z thing?",Those are book ends! That's a great gift!
"Well, I'm telling everyone about you! That's the only way to explain the underwear and the video camera that doesn't make me look like a pig!","No-no, wait! There's got to be a better explanation. You can tell them you had to make an adult film for your adult film class."
We need something old,"Ohh, great, I have condom in my wallet I've had since I was twelve"
"Oh, come on Monica, reliving past pain and getting depressed is what Thanksgiving is all about.","Y'know, for me anyway. And of course, the Indians."
"No, its...Its not that. Umm, now what I'm going to say to you, I'm not saying as your friend. Okay? I'm-I'm saying as it as Monica's older brother.",But you're still my friend?
Pivot! Pivot! Piv-ot! Piv-et!! Piv-ett!!! Piv-et!,Shut up! Shut up! Shut up!!
I've decided to start writing a novel.,"Oh, great. Because the world was just missing a 500-page memoir about your feelings on socks."
"You don't think that umm, 'The chef's Mahi Mahi was awful awful,' is bad press?",I didn't write it.
I just got engaged to my girlfriend.,"Wow, congratulations! Could I BE any more thrilled for you?"
Phoebe hates Pottery Barn.,"Ahh, just like the apothecary tables of yore..."
Monica and Chandler are arguing about what time they said they would meet,"The only way that I said six would be if the seven's, let meet at seven, not at six."
What's the matter with your hand?,"Well I've been playing it for like eight hours, it'll loosen up."
I just got engaged to my soulmate.,"Oh, wonderful! Because nothing says 'soulmate' like someone who's contractually obligated to tolerate you for the rest of your life."
How come all I can think about is putting that ice in my mouth and licking you all over?,Because I went to an all boys high school and God is making up for it.
Come on! Do something!,"I am, I'm ignoring you."
Ross is giving a lecture at the university.,"Wait a minute, hold the phone! You're not talking about Chuckles University?!"
I just got engaged to the love of my life.,"Wow, that's great. I'm sure the 12 minutes you've known them is a solid foundation for a lifetime of misery."
We were just gonna see if you wanted to go.,"Oh well, we don't because we got...the...other pl-place."
"You were on the show years ago and then they killed you off, what happened?","It was so stupid, I said some stuff in an interview that I shouldn't have said. But believe me, that's not gonna happen today."
I just got engaged to my girlfriend.,"Oh, wonderful! Because nothing says 'I love you' like a contract and a lifelong commitment to pretending to listen."
Oh really? Then how come no one here is wearing them?,They're all tourists.
Closer than here?,"Oh, hey, look, I found coffee! Okay, let's skedaddle."
"Nora Tyler Bing: Oh, fine. I'm leaving for New York tomorrow, which I hate- but I get to see my son, who I love...
#ALL#: Awww!",This is the way that I find out. Most moms use the phone.
I just got engaged to my soulmate.,"Wow, a soulmate. How convenient. Now you'll never have to use Tinder again."
You suck at it.,I don't suck. It's sucks. You suck.
"Hey, do you know a six-letter word for red?","Hey, do you know a six-letter word for red? Yeah, I think that's wrong, but there's a Connect the Dots in here for you later. Hey, how about maroon?"
So you want me to help you unpack your stuff?,"Na, na I'm ok. Oh and uh, just so you know, I'm not movin' back in 'cause I have to. Well, I mean, I do have to. It's just that that place wasn't really, I mean, this is..."
"Hey, wouldn't be cool if our duck and chick had a little baby? We could call it Chuck.",Or... Dick.
Waiter: Anything else?,"Yes, how 'bout a verse of Killing Me Softly. You're gonna sneeze on my fish, aren't you?"
"Stop it, stop it, stop it!",Now this feels like Thanksgiving.
Do you want me to come over there and sit on you?,Let's.
"Joey Tribbiani: Chandler, will you just come in already?","No, I prefer to keep a safe distance from all this merriment."
"Oh hey, Gary, want me to grab the berry for ya?",It's called the cherry.
"Okay. Ooh, my! Woah! Why is that baby torturing that woman?!",Why have I seen this thing three times?!
I'm going to start a journal to express my feelings.,"Oh, great, because the world was just missing your innermost thoughts on 300 pages of angst and poorly drawn doodles."
Drum roll.,"Okay. Okay. All right. Help! Am I a Mark, or a John?"
"I guess Joey was right, it does nothing.",See? I'm doing it. I am totally doing it. I lost it.
"Joey said I uh, I needed to relax so he gave me an antihistamine.","Yeah, and then I fell asleep on the subway and went all the way to Brooklyn. Brooklyn is f-far!!"
I think Brenda needs a raise.,How come?
I feel really sad that we're not...really there anymore.,So?
What is that?,Sounds like two people are really enjoying the Dewey decimal system.
"Joey, the new chair will be here in an hour. Maybe we should actually move Rosita out of here. Y'know, start the heeling process?","Well, I guess you're right. Maybe, maybe I'll take her down to the incinerator. It's gonna be so sad, and kinda cool. She's heeled!"
"Oh, my mother's right. I'm never going to get married.","Ahh, you know what? That is....Who wouldn't want you?"
"You guys probably wanna get some hugs in too, huh? Big news!",Whoa-whoa-whoa! We're having kids?!
We can go into detail...,No don't I beg of you!
What's that?,Cookie?
I've decided to start writing a novel.,"Oh, great, because the world was just missing a 500-page manuscript about your feelings."
It was an accident. Not like I was across the street with a telescope and a box of donuts.,"Y'know, I don't know why you're so embarrassed, they were very nice boobies."
"We're having a baby, ok, a baby, you don't stop for Chunkys.",I used to have that bumper sticker.
"Honey, I'm just worried that bosses will see them and think they pay you too much money.",Do you think I work at some kind of boot pricing company?
What if I roll another hard 8?,You roll another hard eight and we get married here tonight.
