context,response
Eddie what're you still doin' here?,"Ah, just some basic dehydrating of a few fruits and vegetables. MAN ALIVE this thing's fantastic!"
We left Joey alone with the food,Which smells delicious
I'm considering a career change to professional snail trainer.,"Oh, great, because the world is just missing that. Could I BE any more thrilled for you?"
You got the lead in a movie? That's amazing! What's the movie about?,"It's called Shutter Speed, it's really cool! Yeah, umm, I meet this girl in the subway and we fall in love in like a day, right? And then, she disappears... But I find out where she lives and when I get there this like old lady answers the door and I say, 'Where's Betsy?' Right? And she says, 'Betsy's been dead for 10 years.'"
Then all your stuff would be here.,"Well, what if all my stuff was here?"
"You're not gonna go anywhere, you said you were gonna eat here, and you're gonna eat here!","Oh, but-but it is, uh, it's just like the first Thanksgiving, when the Indians and the Pilgrims uh, sat down to dinner."
"Okay, we-we swallow our feelings. Even if it means we're unhappy forever.",Sound good?
Is everything okay?,"Oh yes! Just had me a little nubbin-ectomy. Yep! Two nipples, no waiting."
"Y'know what else I can't believe? I had to kiss Phoebe and Rachel every time I left a room, I mean it's too bad they didn't see us having sex.",Do you know anything about women?
Ross is on a date with my sister and they shut the drapes two and a-half-hours ago.,I'm good.
I just got engaged to my girlfriend.,"Oh, great, so now you're officially stuck with someone who's seen you naked and still manages to smile."
"Oh, that's okay, it gave me time to finish glazing my nipples.",Wow! You really go all out when you're expecting company.
Because you sent away the dog!,This is ridiculous.
"Oh, oh that's right, I forgot about your ability to fuse metal.","Hey, it's Funny's cousin, Not Funny."
"Well, maybe after we get reacquainted uh, you can do me.",Yeah-No!!
"Monica Geller: All right people, we're in trouble here. We've only got 12 hours and 36 minutes left. Move, move, move!","Monica, I feel like you should have German subtitles."
"So does he have a hump? A hump and a hairpiece? is not present in the dialogue, however 'Oh, Richard. That's all I ever hear, Richard, Richard, Richard!' can be used","Oh, Richard. That's all I ever hear, Richard, Richard, Richard!"
Why are you wearing Monica's jacket?,Because it's flattering!
"Monica: I don't know, how about the idiot who thought he could drive from Albany to Canada on a half a tank of gas!",Do not speak ill of the dead.
I am very good at Cups.,Okay! Now I assume the Saucer card came up when you played last.
We have a crying child!,Roll the damn cameras!
"I can blow dry it. I can put gel on it. It doesn't matter, I still wind up with this little cowlicky thing on the middle part of my head. It's so annoying. Does it bug you?",You bug me.
I just got engaged to my girlfriend.,"Oh, great, so now you're officially contractually obligated to love someone who's still getting used to your face."
Wow! Why do you want to get rid of her so badly?,"Because she exchanges every gift she ever gets, it's like impossible to get her something she likes. Come on, let's trade!"
"All right, look, look, you've got to do this yourself, okay in person. At least you know her name. You just go to the house and you ask for Mary-Angela, okay, when which ever one she is comes to the door, you take her for a walk, you let her down easy.",What if Mary-Angela comes to the door and I ask for Mary-Angela?
How'd you get in there?,"Made a few calls, pulled some strings, and they agreed to seat us at 11:30 if we both had the chicken and didn't get desert."
I don't wanna give up the bag. I don't have to give up the bag! Do I Rach?,"Oh, hey! Yeah umm, they're called wallets."
"I wonder how I would react under fire, y'know? And not backfire but-but heavy fire, like I was in a war or something.",Before or after you were shot by your own troops?
I'm looking for Eddie Minowick.,"Oh, uh, he's not here right now, uh, I'm Chandler, can I take a message, or, or a fishtank?"
"Really? So, you're gonna stick with this 'it's all for her' thing?","What, are you crazy? When a blind man gets his sight back, does he walk around like this?"
I've decided to start a career as a professional snail trainer.,"Oh, finally, a job that combines your two greatest skills: patience and a complete waste of time."
"Well y'know, I've been walking the same way since high school. Y'know, y'know how some guys they walk into a room and everybody takes notice. I think I need a 'take notice' walk.",Are you actually saying these words?
It's not what you said. It's the way you said it...,"Oh My God, I'm a woman!!!"
What's this?,It's a hand. It's a thing you use as a Jack and Coke holder.
"That's kind of a masculine name, don't you think?",Works on you.
You can't tell anyone! No one knows!,It happened in London.
Men are such idiots.,Totally worth it!
I-I can't believe that sign didn't work!,Y'know what would work? Stop making candy!
Last time I left a spontaneous message I ended up using the phrase...,"""Yes indeedy-o."""
Your mom was arrested?,"Shhh, busy beaming with pride."
You got a minute? I-I really need to talk to you.,"Oh! Uh, yeah! Is this a cold pizza talk or a leftover meatloaf talk?"
"Hey-hey-hey, when uh, when were we on a boat?","Remember that really cold morning, you woke up and those dogs were licking your face?
Well, those were seals, man."
I've decided to start writing a novel.,"Oh, great, because the world is just missing a 500-page memoir about your feelings on socks."
Thanks for coming with me. And thanks again for helping me take a shower.,"Now, is that never talking about it again?!"
Here we go. I'm serving my last cup of coffee. There you go. Enjoy.,Should I tell her I ordered tea?
"I bring you here to see the Bapstein-King comet, one of nature's most spectacular phenomenon, and all you care about are bugs stuck in tar and-and some woman!","Y'know, there's two women dude."
"Hello? Yeah, this is she. Oh! You're kidding! You're kidding! Oh thank you! I love you!","Sure, everybody loves a kidder."
You're going down.,Oh yeah? You're going further down! Downtown!
We still haven't gotten an RSVP from your dad.,"Oh! Right. Umm, maybe that's because I didn't send him an invitation."
"Hey-hey, check out the hat!","What a minute, I know that hat! I was taken aboard that hat! They did experiments on me! I can't have children!!"
She serves to Doug who returns it to Chandler. As it bounces over his head Chandler swings and misses.,"Oopsey, missed it!"
"The wedding is off, sloppy and immature!",That's me! Come on!
"Hey, how was your chef thing?","Well, maybe it was the kind of food that tasted good at first but then made everybody vomit and have diarrhea."
"Forget what I said, I was babbling! Pick me!","No, no, no, I say you have to give your divorce another chance."
If you guys ever have kids...,Whoa-whoa-whoa! We're having kids?!
That's mean! You really had me going there!,"Oh, we could do this all day."
We're moving to Tulsa!,"The Sooner State, whatever that is."
Frank wants to name one of the boy babies Frank JR. JR.,Wouldn't that be Frank the III?
I've decided to become a professional clown.,"Oh, finally, a career that combines your love of silence and dignity."
I just got engaged to my soulmate.,"Wow, congratulations! Could I BE any more thrilled for you and your impending doom?"
"So what, you're just never going to tell her?","Oh, no, no, no, I will! I just want to butter her up, first! You know, I'm going to take her to an amazing Valentine's dinner. Do all this romantic stuff, and then, just when she thinks I'm the best boyfriend in the world, then I'm going to tell her that my pregnant ex-girlfriend is living with me."
I just got engaged to the love of my life.,"Oh, wow. Could this be the start of a beautiful, soul-crushing divorce?"
"Monica, you are now in control of my love life.","Okay, I gotta go to work."
Don't be too long.,Okey-dokey!
I just got engaged to my perfect match.,"Wow, perfect match? That's cute. Did you two meet at a 'I'm-a-control-freak' support group?"
"We were on the platform, ready to dance the world into the new Millennium, and the guy yelled 'CUT!'","Now you do that, you're on TV."
What did you mean when you said pivot?,"Oh, y'know, what did you mean when you said pivot?"
"If one of you had to pick one of the other two guys to go out with, who would you pick?",Joey! No way. I'm not answering that.
I've decided to start a garden in my backyard.,"Oh, great, because what every relationship needs is a competitive vegetable grower, silently judging their partner's tomato yield."
"Yes-yes, I was just trying to figure out a way to uh, demonstrate how I could get my exceptionally large feet into my even bigger mouth.",Didn't I tell ya? Always showin' off.
"Find the one where you make your bedroom eyes. Ohh, there it is.",Oh my God! Those are my bedroom eyes?! Why did you ever sleep with me?
"Ooh, look-look-look-look-look! I got Monica naked!","Nono, that would be me again."
He's asking you out after trying to arrest you?,He has a gun!
"Well, they're not mine!","Well, they're Joey's! They gotta be Joey's!"
You were in an I Hate Rachel club?,Everybody at my school heard it! You were the hermaphrodite cheerleader from Long Island?!
"Hey, who's this little naked guy?",That little naked guy would be me.
I'm really excited for my blind date tonight.,"Oh, joy, a complete stranger who's only talking to you because they haven't seen you yet."
I just got engaged to my girlfriend.,"Oh, great, so now you're officially contractually obligated to love her, even when she leaves the cap off the toothpaste."
How cool would it be if you could watch like a real life-sized version of this?,As crazy as soccer?
"Would you like some more coffee, baby-doll?","Yeah, see, I can't pull of baby-doll can I?"
"Oh please, could she be more out of my league? Ross, back me up here.","Thank you, buddy."
I'd shake your hand but uh; I'm really into the game.,"Plus, I think it'd be better for my ego if we didn't stand right next to each other."
I just got engaged to the love of my life.,"Wow, that's great. I'm sure the 37 times you've said that before had nothing to do with the open bar."
"Yeah, you've been avoiding her ever since we started going out. Look, I made an effort to like Janice, now I think it's your turn to make an effort to like Kathy by going out to dinner with us. Right?",Yeah. Right.
So does it really hurt as bad as they say?,Yeah. You won't be able to take it.
"Happy birthday Grandma! It's better to be over the hill then buried under it. All our love Monica and Chandler. That's funny, yeah!",No-no-no-no! That was the joke!
"So, assistant to the director. That's a really exciting job, I mean, you must have a ton of cool responsibilities.",I have nothing to do with casting.
I didn't know you read tea leaves.,"Oh yeah, I've done it for years. I actually stopped because I was so accurate. Y'know, and-and y'know, one of the great joys of life is it's-it's wondrous unpredictability. Y'know? And also tea tends to give me the trots."
Yeah... I just don't have that much cheffing experience.,Unless it's an all-toast restaurant.
"I ran into Vlad at the place where they sell the big fish, and he said you played here a lot, so umm....","All right listen, I have to go to the bathroom, but if the place with the big fish comes up again. I'd like know whether that's several big fish or just one big fish."
I'm looking for Eddie Minowick.,"Oh, uh, he's not here right now, uh, I'm Chandler, can I take a message, or, or a fishtank?"
I just got engaged to my girlfriend.,"Oh, wow, congratulations! Could I BE any happier for you?"
Maybe it's not what we think. Maybe it's tell Monica I'm sorry I...drank the last of the milk.,"Or maybe he-he was writing to tell her that-that he's changed his name, y'know? Tell Monica I'm sorry."
"Someone's left a glass on the coffee table. There's no coaster. It's a cold drink, it's a hot day. Little beads of condensation are inching their way closer and closer to the surface of the wood...",STOP IT!!
I'm really good at cooking now.,"Oh, yeah, because nothing says 'culinary genius' like setting off the fire alarm three times a week."
I was lucky enough to find someone that I really love,"Wow, y'know when you say it, it doesn't sound so scary"
I'm going to start writing a novel.,"Oh, great, because the world is just missing a 500-page manuscript about your feelings."
"Okay, could you just stop talking for a second?","Yemen. That's right, yes, I'm being transferred to Yemen!"
She's not gonna like the chicken that night either is she?,Y'know what? It's gonna be okay. Y'know what? She's probably not gonna even want to come.
Which part exactly?,The whole thing! Can we go?
"I used all my best stuff! I-I-I lit some candles. I put on some music. I used bath salts, plus bubble bath! And got you this little plastic Navy ship.","Well, this does butch it up a bit."
I don't know how you decide who to hire.,Did she call? You-you told her I was sick right? Always tell her I am sick!
"The basket is totally empty! My God, the neighbors ate all the candy!","Well, either that or uh..."
Look at him.,"Oh, I am no women, but that is one tasty dish."
Don't say things like that in front of Monica. I don't want you putting any ideas in her head.,Wh-wh-why?!
Old?,The young hot ball and chain.
I'm going to work on my interview skills for the coordinator of the woman's collection at Ralph Lauren.,Could I BE any more excited for you?
You won't boss me around anymore?,And you'll be nice?
"I didn't know you and Carol were getting divorced, I'm sorry.",Sorry? Finally chewed my leg out of that bear trap.
I just got engaged to my soulmate.,"Wow, congratulations! I'm sure the 37 other guys she's dated were just, you know, practice."
What's that smell?,I know!
Phoebe takes a bite and spits it out and screams.,"Okay, I'm not gonna have one."
"Yeah, well look at this kitchen, slash bathroom.",Well that's great! Y'know so you can cook while in the tub.
There's a dog sitting on my couch,"Tell her, I'm allergic, and I will sue"
"I love you, man.",I'm still on my first. I just think you're nice.
"I bought groceries, I was gonna make you dinner!",Well next time ask! Or at least wait for me to ask!
You know whose knowledge of her ex-boyfriend is shocking?,"Oh, and you know whose knowledge of her ex-boyfriend is shocking? Monica!"
"Ya know I remember my father, all dressed up in the red suit, the big black boots, and the patent leather belt, sneakin around downstairs.",Who said anything about Christmas?
"Say, what's your favourite thing about summer?","Ohh, that's a good one."
You guys die and I don't get your baby?,Well who would?
What's the big deal about a holiday card?,"Married couples send out cards, families send out cards, people who have been dating for a couple of months do not send out cards!"
Monica and the others discuss the Swing Kings and their appropriateness for the wedding.,But I love swing music!
Doesn't it ever just freak you out that-that you're never gonna be with anybody new again?,"No. No, see when I first meet somebody it's uh it's mostly panic, anxiety, and a great deal of sweating."
That's a plane!,"Well, all right. 1700 bags of peanuts flying that high, that's pretty amazing too."
"All right, what else?","Well uh, there was acting classes, stage combat classes, tap classes..."
"She's with this other guy. For a long time. And I could never do that to the guy, y'know? 'Ccause we're really good friends.",Then talk to him! He might be fine with it.
I just got engaged to my girlfriend.,"Oh, wonderful! Could I BE any more thrilled for you?"
"Oh, they're just gonna umm, look to see if my endometria layer is thick.","Oh, I can uh, check that for ya."
What could she possibly be hiding in here that I can't see?,"I don't know. Ooh, I bet it's Richard."
I just got engaged to the love of my life.,"Wow, congratulations! I'm sure the 12 minutes you've known them is a solid foundation for a lifetime of happiness."
I know! That's why we got to find Monica!! You know where she is?,No!! Okay!! What's with the third degree?! Why don't you just shine a light in my eyes?!
Phoebe knows about us!,"Ahh yes, the messers become the messies!"
Hey Chandler! Did you like the macaroni and cheese?,"Oh yeah, it was great. You should be a chef."
I just got engaged to my soulmate.,"Wow, that's great. I'm sure the 37 others you've called your soulmate will be thrilled to hear that."
I just got engaged to my girlfriend.,"Oh, wow! Because nothing says 'I love you' like a ring and a lifelong commitment to someone who's still getting used to your snores."
You cry every time somebody talks about Titanic!,Those two only had each other!
"Y'know those big-big uh, road signs that say 'Merge?'","Y'know? So I was thinking that we could get one of those signs and hang it over our bed. Because, that's you and I together! Merge!"
"All right! Here we go! 1999! The year of Joey!
What's the matter?!","We wanted to kiss at midnight, but nobody else is going to so y'know..."
"Chandler M Bing? It's not just an M, your middle name is Muriel!!",Shh! It is a family name!
You broke Joey's chair?,Whoa-whoa-whoa! You broke Joey's chair? I thought I broke Joey's chair! That's why I replaced it with mine!
I just got engaged to my girlfriend.,"Oh, wow, because nothing says 'I love you' like a lifelong commitment to someone who's seen you eat an entire pizza by yourself."
I just got engaged to my soulmate.,"Oh, wow. Because nothing says 'true love' like a lifelong commitment to someone who still thinks you're cool."
"All jokes aside, where is this relationship going?","Wait a minute, all jokes aside? I didn't agree to that!"
"Okay, I've got some Ones, you wanna put them in her panties?","No thanks, Mom!"
"Alright, I've got a leg, three breasts and a wing.","Well, how do you find clothes that fit?"
Phoebe and Gary think they're a hotter couple than we are!,"Ohh, so?"
"Why should I? I mean if she wants to move on, that's fine!",You know when 'That's fine' sounds true when someone yells it and spits!
What else would I do?,"Uh, what about y'know the massage thing? That never gave you a heart attack."
That's not whipped! Whipped is wh-tcssh!,That's what I did. Wah-pah!
"I just, I can't believe that we made it!",Well you don't have to sound so surprised.
I just got engaged to my girlfriend.,"Wow, congratulations! Could I BE any more thrilled for you?"
I know that your dad embarrassed you.,"No-no all kids are embarrassed by their parents, you'd have to come up with a whole new word for what I went through."
You just can't stand anyone else enjoying themselves can't you?,I'm Chandler; I make jokes when I'm uncomfortable.
It's almost our anniversary!,I know. Can you believe it? One year ago today I was just your annoying friend Chandler.
How you doin?,"Yeah, now how's that going though? Are you okay with the not-flirting thing?"
If you thought I was going to get you porn for Valentine's Day... you were right!,"Well, I'm not really in a sexy mood right now."
"I'm calling for Monica Geller. I want to let her know that there was a cancellation and if she's still interested in having the Bing-Geller wedding at our facility, it is available...","This is Chandler Bing! This is Chandler Bing! Yes, the groom-No! Not the groom!!"
I just got engaged to my soulmate.,"Wow, that's great. Could I BE any happier for you?"
Ross said our Dad took the trophy and.... threw it in the lake.,And was the curse lifted?
"God, your hair sure is different! Now","Yeah, we were just talking about that. I can't believe how stupid we used to look."
"Joey Tribbiani: It just seems so futile, you know ? All these women, and nothing. I feel like Superman without my powers, you know? I have the cape, and yet I cannot fly.","Well now you understand how I feel every single day, ok? The world is my lesbian wedding."
I just got engaged to my soulmate.,"Wow, a soulmate. How convenient. Now you'll never have to use Tinder again."
I just got engaged to my soulmate.,"Wow, that's amazing. I'm sure the fact that you've known them for three weeks has nothing to do with it."
I just got engaged to the love of my life.,"Wow, congratulations! Could I BE any more thrilled for you... and your impending doom?"
"Monica, what are you doing?! It's never gonna happen, she's seeing somebody.","Yeah, and I don't have any cologne."
In the beginning where y'know it's all sex and talking and sex and talking and...,"Yeah, you-you gotta love the talking."
I just got engaged to the love of my life.,"Wow, congratulations! I'm sure the 12 minutes you've known them is a solid foundation for a lifetime of happiness."
I just got engaged to my soulmate.,"Wow, congratulations! Could I BE any more thrilled for you and your impending lifetime of compromise and arguing over whose turn it is to do the dishes?"
What's this?,An invitation for the At First Sight premiere? Oh my God! Val Kilmer didn't wear this in Batman! He wore it to the premiere of some tooty-fruity love story where he played a blind guy!
The neighbors ate all my candy!!,Mine stole my newspaper! It's like a crime wave!!
What's-what's going on? Phil's really pissed!,Monica's wasted.
You still looking for a place?,Yeah! Why?
I would do it but she thinks I'm attracted to her!,Why?
She's there?!,"Oh yeah, there-there she is!"
I'm going to start writing a novel.,"Oh, great, because the world is just missing a 500-page manuscript about your feelings."
"Monica Geller: Probably some y'know, European good-bye thing he picked up in London.
Rachel Green: That's not European!","Well, it felt French."
"All right look man, I didn't want to bring this up, but Chandler, is the stupidest name I ever heard in my life! It's not even a name; it's barely even a word. Okay? It's kinda like chandelier, but it's not! All right? It's a stupid, stupid non-name!","Wow, you're, you're right. I have a horrible, horrible name."
It's a dead dog. That's Chi-Chi; she died when I was in high school.,It's your parents' anniversary and you're going to talk about their dead pet?
I just got engaged to my perfect match.,"Oh, wow! I'm sure the 37 online quizzes you took had nothing to do with it."
"Okay, I'm going to take him back to Wendy's.","No, no, no, no! He's fine! Look, look, look! Here's your ball! Get your ball! Get your ball! Get your ball! My God, what have I done to you, huh? I broke the dog! Pheebs, I broke the dog!"
I really come off that badly?,"Oh good. Good, because I'm sure this interview is gonna last a couple of weeks."
Then all your stuff would be here.,"Well, what if all my stuff was here?"
You're not helping!,Singing 'I will survive' in a helium voice - not helping.
"And the reason I'm doing this is because I am Joey's friend. And if you were a good friend, you'd be doing the same thing.","Oh, so being a good friend means acting like a total jerk?"
I'm one of the people who applied for the apartment. And I-I realize that the competition is fierce but-I'm sorry.,"I, I can't help but notice you're naked and I applaud you. Man, I wish I was naked."
"I just get off the plane, so I'm feeling kinda gross. Maybe I should just take a shower.","The truth is, I soiled myself during some turbulences."
"Get him! GET HIM! Get him! Get- YESSS! Not laughing now, are ya pal!","See buddy, that's all you need, a bunch of toothless guys hitting each other with sticks."
I just got engaged to my soulmate.,"Wow, congratulations! Could I BE any more thrilled for you and your impending lifetime of compromise and arguments over whose turn it is to do the dishes?"
You got another ex-wife back there?,Please start drinking!
And you'll be topless?,And-Joey!
What?! I just touched him and he went over.,"Okay, you wanna play rough, we can play rough."
"All right then, we'll have a definite answer for you on Monday, but I think I can say with some confidence, you'll fit in well here.",Really?!
We got a lot of time to kill and we're in a building that's full of beds!,And it's so clean!!
Ice Capades.,"Wow, this is serious. Ive never known you to pay money for any kind of capade."
"Oh my God, the cat's made my eyes water! Don't-don't throw it to me! My vision's been compromised!!","Yeah, you almost overreacted to something."
"You know who else picked Rachel? Ross, and you know what else Ross did? He stole my joke.",You know what? I'm going to get a joke journal. Y'know? And document the date and time of every single one of my jokes.
I'd like to have Don and Phoebe over. Wouldn't that be nice?,"Sure, why don't you set it up. I'll just be over here, browsing through the personals."
"I don't know... um, Grease?",Rent?
I'm going to start learning how to cook.,"Oh, fantastic! Because the world was just missing your unique blend of charcoal and regret."
I seem to remember someone bringing his security blanket to college!,That was not a security blanket! That was a wall-hanging!
You look great! That bag is gonna get you that part.,And a date with a man!
My sandwich was next to Ross. I was trying to save my sandwich.,From a bullet!
I just got engaged to my soulmate.,"Wow, a soulmate. How convenient. Now you'll have someone to share your therapy bills with."
"Joey Tribbiani: I can't believe it's Christmas already. Ya know, I mean, one day your eatin' turkey, the next thing ya know, your lords are a-leapin' and you geese are a-layin'.",Which is why geese are so relaxed this time of year.
"Okay! Come on, no peeking!",Our eyes are closed and we're about to cross the street. Very good.
I want a baby.,"Mmmm. Not tonight, honey. I got an early day tomorrow."
Yes have you seen any?,"No. No, haven't seen a monkey. Do you know anything about fixing radiators?"
